en,ko
Social media is a waste of time.,소셜 미디어는 시간 낭비야.
I had fun with Tom and his friends.,나는 톰과 그 친구들과 재밌는 시간을 보냈다.
I haven't kissed Mary yet.,아직 메리랑 키스 못 해봤어.
I feel lonely.,외로워.
Here is the bill.,여기 계산서 입니다.
We've been here since October.,우린 10월부터 여기에 있었어.
How do you like them apples?,사과 좋아요?
"You see, I'm right.","봤지, 내가 맞았어."
Tom is acting really weird right now.,톰은 지금 진짜 이상하게 행동하고 있어.
I want to die.,죽고 싶어.
Raise your hand.,손을 들어 보세요.
I've been working very hard.,난 열심히 일하고 있었어.
Maybe Tom doesn't remember me.,아마 톰은 날 기억하지 않아.
Don't touch the flowers.,꽃을 건드리지 마세요.
Do you like tofu?,두부를 좋아하시나요?
I'm extremely fat.,나 정말 살쪘어.
Tom was diagnosed with ASD when he was three.,톰은 세 살 때 자폐 범주형 장애로 진단받았다.
I made reservations.,예약해 놨어.
We want to make sure.,우린 확실히 하고 싶어해.
I warned you once.,난 널 한 번 경고했어.
"Excuse me, where's the exit?",실례합니다. 출구가 어디인가요?
She'll be getting married next year.,그녀는 내년에 결혼한다.
Tom drank a whole bottle of wine.,톰은 와인 한 병을 마셨다.
Tom seems interested.,톰이 관심있어 보이네.
I can't believe you would do that for me.,네가 날 위해 그걸 해줄 것 같진 않은데.
Once again.,한 번 더.
Tom and John pretended to be brothers.,톰이랑 존은 형제인 척 했다.
I'm heartbroken.,제 마음이 아파요.
Keep smiling.,계속 웃고 있어봐.
My daughter is still under three years old.,내 딸은 아직 3 살 아래야.
He plays tennis very well.,그는 테니스를 잘 친다.
You may use my computer if you want to.,내 컴퓨터 쓰고 싶으면 써도 돼.
I should have listened more carefully.,내가 좀 더 귀기울여 들었어야 했는데.
I know Tom knows I should do that.,나는 톰이 내가 그렇게 해야한다는 것을 안다는 것을 안다.
Do you think French is difficult?,프랑스어가 어렵다고 생각하세요?
Do you think Croatian is an interesting language?,크로아티아어가 재미있는 언어라고 생각하세요?
I'm going to change my shirt.,나는 셔츠를 바꿀 것이다.
Tom told Mary not to swim there.,톰은 매리한테 거기서 수영하지 말라고 말했다.
I'm not good at public speaking.,난 발표를 잘 못해.
I'm still in love with Mary.,나는 아직 메리를 사랑해.
I said I'm sorry.,미안하다고 했잖아요.
Tom says you're lonely.,톰이 말하길 네가 외로워한대.
I thought Tom looked lonely.,톰이 외로워 보이는 줄 알았어.
This desk is too small for Tom.,이 책상은 톰에게 너무 작다.
This seat's free.,이 자리 비었어
Tom won.,톰이 이겼어.
I've caught a cold.,감기 걸렸어.
Be confident.,자신감을 가지세요.
They got addicted.,그 사람들 중독되었어.
Have you ever been to Canada?,캐나다에 가본 적 있어?
Tom is listening to Mary.,톰은 메리의 말을 듣고 있어.
Tom lives somewhere around here.,톰은 여기 어딘가에 산다.
She was my boss.,그는 내 상사였다.
Sit here.,여기 앉아.
She isn't married.,그는 미혼이다.
I thanked him for what he had done.,나는 그가 한 일이 감사했다.
There are thirty students in my class.,내 수업에는 서른 명의 학생이 있어.
I think French is the most beautiful language.,프랑스어는 가장 아름다운 언어인 것 같아.
Tom loves cats.,톰은 고양이를 사랑한다.
He swims better than I do.,그는 나보다 수영을 잘 한다.
That man died of lung cancer a week ago.,저 사람은 일주일 전에 폐암으로 죽었다.
Put your hands up!,손들어!
I feel bad.,기분이 나쁘다.
Do you think our climate has an influence on our character?,기후가 우리 성격에 영향을 준다고 생각하십니까?
I don't know either.,나도 몰라.
I hope that I can do it.,내가 할 수 있길 바라.
Tom wasn't able to sleep on the bus.,톰은 버스에서 잠을 잘 수가 없었다.
Did you receive the message I sent you yesterday?,제가 어제 보낸 문자 메시지를 받으셨나요?
I'd be devastated.,난 피폐해질 거야.
"It was inevitable, wasn't it?",어쩔 수 없었지 않니?
What's your favorite Harry Potter book?,여러분이 좋아하는 해리포터 책은 무엇인가요?
I know what Tom needs to do.,나는 톰이 무엇을 할 필요가 있는지 알고 있다.
Let's get a group photo.,단체 사진을 찍읍시다.
We didn't find a weapon.,우리는 무기를 찾지 못했다.
"Every time I read this novel, I find it very interesting.","나는 이 소설을 읽을 때마다, 매번 이 소설에 흥미를 느낀다."
Do you have proof?,증거 있어?
My father is suffering from influenza.,우리 아빠는 인플루엔자에 걸려 있어.
Tom is worked up.,톰은 흥분해 있다.
The police are looking for you.,경찰이 너를 찾고 있다
Who is your favorite author?,당신이 가장 좋아하는 작가는 누구입니까?
She tried.,그녀는 노력했다.
Tom thought that Mary would be jealous.,톰은 메리가 질투날 거라고 생각했어.
Tom is a man with a good heart.,톰은 선한 마음을 가진 남자야.
What language do they speak in your country?,네 나라에서는 무슨 언어로 말해?
Aren't you afraid?,두렵지 않아?
It's written in French.,이건 프랑스어로 쓰여 있어.
We had to keep it secret.,우리는 그것을 비밀에 부쳐야 했다.
Definitely!,절대로!
Tom's lying.,톰은 거짓말 치고 있어.
They were naive.,걔들이 순진했어.
Why did you come?,왜 왔어요?
I have to take the entrance exams next year.,나 내년에 입학시험을 봐야 돼.
Please take one.,하나 가져가세요.
Why does everybody think Tom and I are stupid?,왜 다들 나랑 톰이 멍청하다고 생각해?
Most dogs have brown eyes.,개는 대부분 갈색 눈을 가지고 있어.
I'd be happy to teach you French.,여러분께 프랑스어를 가르치게 돼서 기뻐요.
I wish Tom could've been there.,탐이 거기 있었으면 좋았을텐데
Tom sat in the darkness.,톰은 어둠 속에 앉아 있었어.
Look me up next time you're in Boston.,다음에 보스턴에 오면 나랑 만나자.
Tom's important.,톰은 중요하다.
Tom didn't marry Mary.,톰은 메리와 결혼하지 않았다더라.
"Usually, things don't work like that.",보통은 그런 식으로 돌아가지 않죠.
I don't like sitting on the floor.,난 바닥에 앉는 건 별로야.
Forget Tom.,톰은 잊어버려.
Tom got retired.,톰은 은퇴했어.
I won't permit it.,나는 그것을 허락하지 않을거야.
I think Tom wouldn't be forgiven for doing that if he weren't so young.,톰이 그렇게 어리지 않았다면 그걸 함으로써 용서받지 못했을 거야.
I have a sister.,나에게는 여자 형제가 있다.
"The following morning, the snowman was completely melted.","다음 날, 눈사람은 완전히 녹아버렸어."
Why are you so popular?,너는 어떻게 그렇게 인기가 많니?
That doesn't sound like a good idea.,그리 좋은 생각 같아 보이진 않는다.
That's just my guess.,그건 단지 내 추측이야.
I thought Tom was having a party.,나는 톰이 파티를 열고 있는 줄 알았다.
He will come soon.,그는 금방 올 것이다.
They refused.,그 사람들은 거절했어.
Tom doesn't think Mary will be lonely.,톰은 메리가 외로울 거라고 생각하지 않아.
They need the money.,그들은 그 돈이 필요하다.
Tom doesn't smoke.,톰은 비흡연자다.
The cause of the fire is yet unknown.,화재의 원인은 아직 알려지지 않았어.
I hate silent movies.,나는 무성영화가 싫다.
Tom is a rough man.,톰은 거친 남자야.
I acted like a fool.,나는 바보같이 굴었어.
What's Mary's husband's name?,메리 남편의 이름은 뭐야?
Tom is smoking a cigar.,톰은 담배를 피우고 있어.
You should smoke less.,당신은 담배를 적게 피워야 한다.
I was miserable and unhappy.,나는 비참하고 불행했어.
You two are adorable!,너희 둘 정말 귀엽네!
"I thought you might be lonely, so I came over with a bottle of wine.",니가 좀 외로울 것 같아서 내가 와인 한 병을 들고 왔지.
This is my dream job.,이건 내 꿈의 직장이야.
What's your Skype username?,네 스카이프 사용자 이름은 뭐야?
Wow! It's been a long time.,와! 이게 얼마 만이야.
I told Tom to lie.,난 톰한테 거짓말 하라고 말했어.
What's the real goal?,진짜 목표는 뭐야?
Where can I find a place to change money?,환전소가 어디에요?
Keep dancing.,계속 춤춰.
Tom still looks sleepy.,톰은 아직도 졸려 보여.
Tom thinks Mary can understand French.,톰은 메리가 프랑스어를 이해하는 줄 알아.
This information is very important to us.,이 정보는 우리한테 많이 중요해.
Is Santa Claus real?,산타는 실제로 있을까?
Are you accusing Tom?,톰을 고발하는 거야?
Tom is a boy about your age.,톰은 너와 같은 또래의 남자애야.
Is there anybody here who speaks French?,프랑스어 할 줄 아는 사람 여기 있어?
I believe in love.,난 사랑을 믿는다.
The United States is a large country.,미국은 거대한 국가다.
She hugged him.,그녀는 그를 안아주었다.
I know what those situations are like.,저는 그 상황들이 어떤지 알아요.
Are you still single?,당신은 아직 솔로입니까?
Do you like running?,달리기 좋아해?
Tom was born in 2013.,톰은 2013년에 태어났어.
I'll be back after lunch.,점심 후에 돌아오겠다.
Check this.,이거 확인해봐.
Tom enlisted.,톰이 입대했어.
How many concerts did you go to last year?,지난해에 콘서트를 몇 번이나 갔어?
Mary died of breast cancer.,메리는 유방암으로 죽었어.
I prefer quality to quantity.,나는 양보다 질을 선호해.
Tom has three children.,톰은 애들이 3명 있다.
I knew it would be impossible for me to win.,내가 이기기 불가능할 거라는 건 알고 있었어.
When should I feed my dog?,우리 개에게 언제 사료를 줘야 하나요?
Hurry home.,빨리 집에 가자.
Tom had difficulty concentrating on his work.,톰이 일에 집중하는 데 어려움을 겪더라.
"One more bottle of wine, please.",와인 한 병 더 주세요.
They kissed.,그 사람들 서로 키스했어.
Your lips are red.,네 입술 빨개.
I baked Tom a cake.,나는 톰에게 케이크를 구워줬다.
Don't forget to floss.,치실 쓰는 것을 잊지 마.
Why are you telling this to me now?,왜 이걸 지금 말해?
Keep next Sunday free.,다가오는 일요일에 일정을 비워두세요.
Sorry?,잘 못 들었어요.
Do you live near here?,여기 근처에 사니?
You're getting into deep water.,넌 깊은 수렁에 빠지고 있다.
Working in such conditions was especially difficult.,저런 상태에서 일하는 것은 특히 어려운 일이었다.
Everybody needs to be quiet.,모두 조용히 해야 한다.
I love walking along the river.,나는 강변 산책이 좋다.
Speak up!,크게 말해!
I can't imagine a day without you.,네가 없는 날이란 상상도 못 하겠어.
Tom doesn't want to spend the rest of his life in prison.,톰은 남은 인생을 감옥에서 보내고 싶어하지 않아.
Wait!,기다려!
What's your favorite Harry Potter book?,너는 무슨 해리포터 책을 좋아해?
It seems difficult.,어려워 보인다.
We're college students.,우리는 대학생입니다.
I wanted to see Tom's room.,톰의 방을 보고 싶었어.
I'm not telling you to go alone.,혼자 가라는 소리가 아니야.
Tom is a wonderful man.,톰은 환상적인 남자야.
Tom smiled.,톰이 웃었어.
Tom has an addictive personality.,톰은 중독 성향이 있어.
You finally succeeded in getting a job.,너 드디어 취직 성공했구나.
Everyone looked.,모두들 쳐다봤어.
Didn't you know Tom was living with Mary's family?,톰이 메리 가족과 살고 있다는 것을 몰랐니?
Tears filled her eyes.,그의 눈이 눈물로 가득했다.
Are you enjoying your weekend?,주말 즐겁게 잘 보내고 있어?
The fact that Tom did that can't be denied.,톰이 그걸 했다는 사실은 부인할 수 없는 사실이야.
"You've never studied French, have you?",너 프랑스어 공부해본 적 없지?
"I can handle this, no problem.","내가 처리할 수 있어, 문제 없어."
Examine this.,이걸 조사해봐.
Tom came here to learn French.,톰은 프랑스어를 배우러 여기에 왔어.
He runs very fast.,그는 달리기가 매우 빠르다.
Tom is a tall man.,톰은 키다리다.
I've worked three hours already.,난 이미 세 시간을 일했어.
"Are these yours, Tom?","탐, 이것들이 너의 것이야?"
You ought to study French.,넌 프랑스어를 공부해야 돼.
You must stop him.,넌 그 사람을 멈춰야 해.
I've never played tennis with Tom.,난 톰이랑 테니스 쳐 본 적이 없어.
I used to keep a diary in English when I was a student.,나는 학생일 때 영어로 일기를 쓰곤 했다.
I learned how to cook from Tom.,난 톰한테서 요리하는 법을 배웠어.
He will come soon.,그는 곧 올 것이다.
It's from the Bible.,그것은 성경에서 나왔습니다.
How do you feel?,어떤 기분이야?
How many days do you plan to stay?,며칠 동안 있을 예정이에요?
This movie is suitable for children.,이 영화는 아동용이다.
I thought you said you'd help us do that.,당신이 우릴 도와준다고 말한 줄 알았다.
I am a monk.,나는 수도승이다.
I explained it to him.,나는 그에게 그것을 설명했다.
This elevator does not go above the sixth floor.,이 엘리베이터는 6층 위로 가지 않는다.
Tom is bedridden now.,톰은 지금 아파서 누워 있어.
Answer me.,대답해.
"Tom is concentrating, isn't he?",톰은 집중하고 있지?
What a hot day!,정말 더운 날이었어!
Stay there.,거기 있어.
I know I can count on all of you.,나는 내가 너희 모두를 믿을 수 있다는 것을 안다.
Tom confessed.,톰이 자백했어.
Why are you still working?,왜 아직도 일하는 중이야?
"By the way, did you find the umbrella you said you'd lost the other day?","그나저나, 전에 잃어버렸다던 우산 찾았어?"
"This isn't a crime, is it?","이건 범죄가 아닌 거지, 그치?"
I got lost.,나는 길을 잃었다.
What is that?,저것은 무엇입니까?
Tom taught me French.,톰이 나한테 프랑스어를 가르쳤어.
I'm the owner of this company.,나는 이 회사의 주인이다.
I envy you.,네가 부러워.
Tom hasn't decided yet.,톰은 아직 결정하지 못했다.
Tom opened the windows.,톰은 창문을 열었어.
These scissors don't cut well.,이 가위 잘 안들어요.
I enjoy watching children play.,나는 아이들이 노는 것을 보는 게 즐겁다.
That medicine worked.,그 약은 효과가 있었다.
He didn't reply to my letter.,그는 내 편지에 답장을 하지 않았다.
There you are.,거기 있어.
I just had breakfast with Tom.,나는 톰과 이제 막 아침을 먹었다.
This mushroom is not good to eat.,이 버섯은 먹을 것이 못 된다.
He gave me a wink.,그는 나에게 윙크를 했다.
Tom's explanation was too complex.,톰은 너무 복잡하게 설명해.
I think it's cruel to keep a cat indoors.,고양이를 실내에만 두는 건 잔인한 것 같아.
Could someone let the dog out?,이 개 좀 내보내줄 사람?
Put your mind at ease.,안심하세요.
Have you ever studied archeology?,고고학을 공부해 본 적 있어?
Are you deaf?,귀가 안 들리시나요?
I doubt Tom can do that without some help.,톰이 도움 없이 그걸 잘 해낼 수 있을지 모르겠다.
I know them.,나 걔 알아.
I wonder if Tom is as old as Mary.,톰이 메리와 나이가 같은지 궁금하네.
"To be a good translator, I think Tom needs to hone his skills a bit more.",좋은 번역가가 되려면 톰은 기술을 좀 더 연마할 필요가 있다고 생각한다.
Tom asked Mary a few questions that she wasn't able to answer.,"톰은 메리한테 몇 가지 질문을 했는데, 그 질문들은 메리가 답할 수 없는 것들이었어."
I thank you from the bottom of my heart.,진심으로 감사합니다.
Of course.,물론이죠.
They hugged.,그 사람들은 서로 포옹했어.
French is interesting.,프랑스어는 흥미로워.
I heard a buzzing noise.,윙윙거리는 소리가 들렸어.
We talked.,우린 서로 얘기했어.
He loves singing.,그는 노래하기를 좋아한다.
I usually keep a diary when I travel.,나는 여행할 때 보통 일기를 쓴다.
It's not impossible.,불가능하지 않다.
What are their true intentions?,그 사람들의 실제 무슨 속셈인 거야?
Is that blood?,그거 피야?
I hugged her.,나는 그녀를 안아주었다.
You have to leave.,너는 떠나야 한다.
"I'm a taxi driver, too.",저도 택시기사입니다.
Tom is unbelievably naïve.,톰은 못 믿길 정도로 순진해.
This sentence isn't useful for language learners.,이 문장은 언어 학습자에게 유용하지 않다.
That made me curious.,저게 궁금하게 하네.
Tom hates me.,톰은 나를 미워한다.
I'll be OK.,나는 괜찮을 거야.
Tom is married to a Canadian woman named Mary.,톰은 메리라는 캐나다 여성이랑 결혼했어.
It is foggy.,안개가 꼈다.
I don't think that this is a fake.,이게 가짜같진 않은데.
How cute!,귀엽잖아!
I think Tom has lied to us.,톰이 우리한테 거짓말 한 것 같아.
Tom is getting coffee.,톰은 커피를 마시고 있어.
It is white as snow.,눈처럼 하얘.
Welcome.,어서오세요.
I can't go any farther.,나는 더 이상 멀리 갈 수 없다.
We've wasted a lot of time.,우리는 허송세월을 보냈어.
I'm a member of the swimming club.,나는 수영 클럽의 회원이다.
The game starts 2:30.,게임은 2:30에 시작해.
There's no other way to do this.,그걸 하는 데에는 다른 방법이 없어.
I think that's inaccurate.,이건 부정확한 것 같아.
Hi.,안녕.
Drive carefully.,운전 조심해.
Was it you who told Tom not to do that?,그걸 하지 말라고 톰한테 말한 게 너야?
Tom is taking baby steps.,톰은 걸음마를 하고 있어.
Mary giggled.,메리는 낄낄댔다.
My ideas are different from yours.,제 생각은 당신과 다릅니다.
Tom is wearing blue jeans.,톰은 파란 바지를 입고 있어.
I used to drive a truck.,나는 트럭을 운전했었다.
Tom has been fired.,톰은 해고당했다.
There are thirty students in my class.,내 학급에는 서른 명의 학생이 있어.
See below.,아래를 봐.
We're married.,우리는 결혼했다.
It is our obligation to help.,우리의 의무는 도와주는 것이다.
What you said is complete nonsense.,당신이 말한 것은 완전히 말도 안 된다.
Do you want to try it?,한번 해 볼래?
I think it's dangerous to climb that mountain alone.,저 산에 혼자서 등반하는 건 위험한 것 같아.
This is very sweet.,이것은 정말 달다.
Don't lie.,거짓말 하지 마.
What did you do with my book?,내 책에 무슨 짓을 한 거야?
He has absolutely no respect for other people's feelings.,그는 타인의 기분은 전혀 존중하지 않는다.
Will you help us now?,이제 우릴 도와줄 거야?
Come along.,따라와.
Silver is worth less than gold.,은이 금보다 가치가 낮아.
It is said that he was very rich.,그는 매우 부자라고 한다.
The moon doesn't have an atmosphere.,달에는 공기가 없어.
French is my favorite language.,프랑스어는 내가 가장 좋아하는 언어야.
Cook for me.,날 위해 요리해 줘.
Keep singing.,계속 노래하고 있어.
I was very surprised to see students cleaning their classroom after school.,나는 방과후에 교실을 청소하는 학생들을 보고 몹시 놀랐다.
Is there anything that you'd like to tell me?,뭔가 하고 싶은 얘기 없어?
Are you saying that you don't know how to do this?,이걸 어떻게 하는지 모른다고 말하는 거야?
Can I go now?,이제 가도 되나요?
Tom started yelling.,톰은 소리지르기 시작했다.
I'm quite happy here.,난 여기 꽤 만족스러워.
I decided to go abroad to study.,난 공부하러 외국에 가기로 결심했어.
Tom doesn't know what to do.,톰은 그가 뭘 해야 할지 모른다.
I have three daughters.,나는 딸이 셋 있다.
He can speak five languages.,그 사람은 다섯 개 국어를 할 줄 알아.
Don't eat it.,먹지 마.
Tom started getting angry.,톰은 화가 나기 시작했다.
Tom thinks that Mary is lonely.,톰은 메리가 외롭다고 생각해.
I have a cold.,감기에 걸렸어.
Tom reached into his bag and pulled out a book.,톰은 가방에 손을 넣어 책을 꺼냈다.
I guess this is a coincidence.,이건 우연의 일치인 것 같아.
Tom needs water.,톰은 물이 필요하다.
Ladies first.,숙녀분 먼저.
Blood is red.,피는 붉다.
Who is your favorite singer?,좋아하는 가수는 누구예요?
No one lives in that building.,저 빌딩에는 아무도 살지 않는다.
Have you ever been to another country?,다른 나라에 가본 적 있어?
Will it rain today?,오늘 비가 올까요?
He is proud of being a doctor.,그는 의사가 된 것이 자랑스럽다.
Is it safe to eat food that has dropped on the floor?,바닥에 떨어진 음식을 먹어도 안전할까?
Come home right away.,바로 집으로 오세요.
Are you crying?,우니?
Are you crying?,울고 있어?
Asperger syndrome is a form of autism.,아스퍼거는 자폐증의 일종이야.
I need printer paper.,프린터 종이가 필요하다.
Tom is holding a gun.,톰은 총을 들고 있어.
Humans originated in Africa.,인간은 아프리카에서 기원했다.
Did you hear the announcement?,그 발표 들었니?
Don't lie to us.,저희에게 거짓말 하지 마세요.
I can only tell you what I know.,저는 오직 제가 아는 것만 말할 수 있습니다.
"This year, Valentine's Day falls on a Sunday.",올해는 발렌타인 데이가 일요일이다.
My reputation has been destroyed.,내 평판은 파탄났어.
She bought vegetables yesterday.,그녀는 어제 야채를 샀다.
I didn't sleep at all last night.,나는 지난밤에 전혀 자지 못했다.
I'm not sulking.,나 삐친 거 아니야.
I'm proud of Tom's accomplishments.,난 톰의 성과가 자랑스러워.
I have a feeling he is right.,나는 그가 옳다고 느꼈다.
I didn't know that you used to teach French.,나는 네가 프랑스어를 가르쳤는지 몰랐어
"Can I have the key now, please?",열쇠를 지금 챙겨가도 될까요?
Tom will be in his room all day today.,톰은 오늘 하루종일 방 안에 있을 것이다.
People are still suffering.,사람들은 아직도 고통받고 있어.
Tom sold everything he had.,톰은 가진것을 모두 팔았다.
Can I take your word for it?,내가 그것에 대한 너의 말을 믿어도 되겠니?
He's not going to visit you tomorrow.,그 사람은 내일 너를 보러 가지 않을 거야.
Everyone changes.,누구나 바뀌어.
I wonder whether Tom has already left.,Tom이 이미 떠난 건지 궁금해요.
I still sometimes do that.,난 아직도 가끔씩 그것을 한다.
Tom is too old.,톰은 너무 늙었어.
"If you don't study hard, you'll continue to get poor scores.",열심히 공부하지 않으면 앞으로도 낮은 점수를 받게 될 거야.
My internet connection was cut off.,인터넷 연결이 끊겼다.
Be confident.,자신감 가져.
What makes you think Tom will listen to you?,왜 톰이 너의 말을 들을거라고 생각하니?
Can I see this one?,이것 좀 보여주실래요?
Tom sat two rows ahead of me.,탐은 나보다 2줄 앞에 앉았다.
He earns twenty dollars a day.,그는 하루에 20달러를 번다.
This dictionary is mine.,이 사전은 내 것이다.
Can I find you on Facebook?,페이스북 계정 있으신가요?
I wonder whether Tom left early.,톰이 일찍 떠났는지 궁금하네.
I don't think Tom wants to be my friend anymore.,나는 더 이상 톰이 내 친구가 되고 싶어한다고 생각하지 않아.
You're too old.,넌 너무 늙었어.
Sorry?,뭐라고 하셨나요?
This is a dangerous job.,이건 위험한 일이야.
I hear you're very rich.,당신이 돈이 많다고 들었다.
Tom is stupid.,톰은 멍청하다.
Two heads are better than one.,둘이서 머리를 맞대면 혼자보다 낫다.
Forgive us.,우릴 용서해 줘.
I feel guilty.,죄책감이 들어.
Tom is tall and strong.,톰은 키도 크고 힘도 세다.
Tom finally mustered up the courage to ask Mary to go out with him.,톰은 마침내 용기를 내어 메리에게 데이트 신청을 했다.
I won!,내가 이겼어!
Who's playing the guitar?,누가 기타를 연주하고 있습니까?
Tom is so rude.,톰은 정말 무례하다.
Congratulations!,축하해!
Tom didn't vote.,톰은 투표 안 했어.
He died yesterday.,그는 어제 죽었어
I don't know why you're studying French.,어째서 네가 프랑스어를 공부하고 있는지 모르겠어.
Eat slowly.,천천히 먹어.
I think they like you.,그들이 널 좋아하는 것 같아.
Come and see this.,와서 이것좀 봐.
Why didn't you help me?,왜 나를 도와주지 않은 거야?
It's suicide.,자살입니다.
You are beautiful.,아름다우시네요.
Tom wants to stay home tonight.,톰은 오늘 밤 집에 있고 싶어한다.
Do you like women?,당신은 여자를 좋아합니까?
Tom and Mary have a daughter.,톰과 메리에게는 딸이 있다.
Tom died in his kitchen.,톰은 자택 부엌에서 죽었어.
Please continue.,계속 해줘.
He was nearly drowned.,그는 물에 빠져 죽을 뻔 했다.
