en,ko
She said that she was ill.,그녀는 아팠다고 말했다.
"Go away, Tom.","저리 가, 톰."
Why did you want to buy them?,왜 그걸 사고싶어했어?
Give me a red pencil.,빨간색 연필 줘.
"Music is an art, not a science.","음악은 예술이지, 과학이 아니야."
I had difficulty in solving this problem.,이 문제를 해결하는 데 곤욕을 겪고 있다
My brother lives in a small village.,내 동생은 한 작은 마을에 살고 있어.
Tom is ashamed of his body.,톰은 자기 몸을 창피해하고 있어.
Where's the butter?,버터가 어디 있습니까?
His reply was negative.,그의 대답은 부정적이었다.
Tom is quick.,톰은 날렵해.
I can't believe that Tom actually spent money on this.,톰이 정말로 이런 데에 돈을 썼다니 믿을 수가 없다.
I hate my voice.,나는 내 목소리가 싫다.
"Bread is made from flour, water and yeast.","빵은 밀가루, 물, 이스트로 만든다."
How many times a week do you play tennis?,일주일에 몇 번 테니스 쳐?
I tried to act cool.,나는 쿨하게 보이려고 노력했어.
I don't understand you.,네가 이해가 안돼.
This coat doesn't have pockets.,이 코트에는 주머니가 없다.
I couldn't get the cork out of the bottle.,병에서 코르크를 뺄 수 없었어.
What convinced you to change your mind?,뭐가 네 마음을 바꾸게 했어?
Who quit?,누가 그만둬?
Please check my vision.,내 시력 검사 부탁해.
"If there's a way out of here, we'll find it.",여기서 나갈 방법이 있다면 우리는 찾을 수 있을거야
Tom wants to avoid everything.,톰은 모든 것을 회피하고 싶어해.
Do you like fish?,물고기 좋아하나요?
I'm just watching television.,난 그냥 티비를 보고 있어.
This is a little weird.,이건 좀 이상하다.
I know Tom knows that I should do that.,나는 톰이 내가 그렇게 해야한다는 것을 안다는 것을 안다.
He is nice.,걔 괜찮아.
Don't lie to me.,내게 거짓말 하지 마.
There's a spider in the box.,상자 안에 거미가 있어.
I'm not very interested in learning French.,프랑스어 배우는 것은 그다지 관심 없어.
The question is whether he can be trusted.,문제는 그 사람이 신용할 만한 사람인지야.
It was almost noon when I woke up.,깨어나 보니 정오가 다 되어 있었다.
"If you do that, you're going to look ridiculous.",네가 그걸 한다면 넌 우습게 보일 거야.
I didn't go to school last Monday.,나는 지난 월요일에 결석했다.
Tom hasn't called the police yet.,톰은 아직 경찰을 부르지 않았다.
You can't eat chicken? How do you know if you never try it?,닭을 못 먹는다고? 먹어보지도 않고 어떻게 알지?
Everyone smiled.,모두들 미소지었어.
Tom is very happy here.,톰은 여기 있어서 아주 행복해하네.
"If Tom saw you doing that, he'd cry.",톰이 네가 이걸 하는 걸 본다면 울게 될 걸.
Have you ever been betrayed by a friend?,친구에게 배신 당해본 적 있어?
Where do you want to go this summer vacation?,이번 여름 휴가 때 어디 가고 싶어?
I'm not in the mood.,그럴 기분 아니야.
"You look tired, so you should go to bed early.",피곤해 보이니까 일찍 자는 것이 좋겠다.
Tom lives in the room above us.,톰은 우리 윗방에 살아.
Why is this happening again?,왜 또 이런 일이 벌어지는가?
"Some were farmers, some were hunters.","어떤 이는 농부였고, 어떤 이는 사냥꾼이었다."
Tom asked Mary to go home early.,톰이 메리한테 집에 일찍 가라고 부탁했어.
I'm embarrassed.,창피해.
"It was cloudy, with occasional rain.",흐리고 가끔씩 비가 내렸다.
My brother is a professor.,내 오빠는 교수야.
Tom said goodbye and left.,톰은 작별인사를 하고 떠나버렸어.
"It doesn't matter how old you get, you can learn.",나이에 상관 없이 배울 수 있어.
I took a shower.,나는 샤워를 했다.
I'm not sure what they want.,그들이 원하는 게 뭔지 모르겠다.
We never should've gone to Australia.,우린 절대 호주에 가지 말았어야 했는데.
Tom has agreed to take a lie detector test.,톰은 거짓말 탐지기 테스트를 받는 것에 동의했다.
Choose one from among these.,그중 하나를 고르세요.
I think it's definitely worth it.,이건 확실히 가치 있는 것 같아.
I have to give this book to Tom.,톰에게 이 책을 줘야 합니다.
My sister asked my father to buy her a new bicycle.,우리 누나는 아버지에게 새 자전거를 사 달라고 부탁했다.
This code can't be cracked.,이 코드는 해독할 수 없습니다.
I'm glad that you're back in Boston.,네가 보스턴으로 돌아와서 기쁘다.
Drink to my health.,건강을 위해 건배.
Tom is at the bar.,톰은 바에 있다.
Breathe in.,숨 들이쉬세요.
Where do ideas come from?,아이디어는 어디에서 나와?
Tom thought that Mary might do that.,톰은 메리가 그것을 할 지도 모른다고 생각했다.
There's not enough water.,물이 별로 없다.
Do you want him?,그 남자를 원해?
There's already a plan in place.,이미 계획이 세워져 있어요.
Do you want some breakfast?,아침 먹을래?
Children need to be fed.,어린이들은 먹어야만 한다.
Tom ran after the dog.,톰은 개를 쫓아갔어.
Tom is very tall for his age.,톰은 나이에 비해 키가 매우 커.
Turn left.,좌회전해.
We were retreating.,우리는 후퇴하고 있었다.
Tom lives next door.,옆 문으로 가면 톰이 사는 곳이 나온다.
Romania is a Balkan country. Its capital is Bucharest.,루마니아는 발칸 국가이다. 수도는 부쿠레슈티이다.
The world is full of problems.,세계는 문제투성이다.
Did you love me?,당신은 저를 사랑했습니까?
Nobody is too old to learn.,배움에 나이는 없어.
Carry this.,이거 운반해.
Cats are cute.,고양이는 귀여워.
Everything is about to change.,모든 것이 변하기 직전이다.
One woman was killed.,여자 한 명이 살해당했어.
Does anyone oppose the new plan?,새로운 계획에 반대하는 사람있습니까?
Is the bank open?,은행 문 열었어요?
"If you don't help Tom, he'll have trouble doing it.",네가 톰을 도와주지 않는다면 톰은 어려움을 겪을 거야.
Nobody knows why he left the town.,그가 왜 마을을 떠났는지 아무도 몰랐다.
This dog is almost human.,이 강아지는 거의 사람같아.
Greece is an old country.,그리스는 오래된 나라이다.
I know that Tom is a very generous man.,나는 톰이 매우 관대한 사람이라는 것을 안다.
We'll be right here.,우린 바로 여기에 있을 거야.
Have you ever done that?,한번이라도 해본 적 있어?
Thanks for the warning.,경고 고마워.
I'd like to hear you sing.,네 노래를 듣고 싶어.
Can't you give me a lower price?,더 깎아주시면 안 돼요?
She has ten children.,그녀에게는 자식이 열 명 있다.
Stop yelling!,그만 소리쳐!
We need to review the case.,우리는 그 사건을 검토할 필요가 있다.
I went there yesterday.,나는 어제 그곳에 갔다.
Tom seemed to be lonely.,톰은 외로워 보였어.
I quit.,나 나간다.
My family is with me.,우리 가족은 나와 함께 있다.
He's in his fifties.,그 사람은 오십 대야.
Tom didn't have dinner last night.,톰은 지난밤에 저녁을 먹지 않았다.
All aboard!,모두 타!
I often dream in French.,나는 종종 프랑스어로 꿈을 꿔.
It's very good.,아주 좋다.
I don't want to marry you.,저는 당신과 결혼하기 싫어요.
This is the biggest cat that I've ever seen.,이것은 내가 본 것 중 가장 큰 고양이이다.
I wish that I could've helped Tom more.,내가 톰을 더 도와줄 수 있었다면 좋았을 텐데.
Why are you walking so fast?,왜 그렇게 빨리 걸어?
You're very nice.,당신 참 멋있어요.
I know who he is.,나는 그가 누군지 안다.
I know that Tom is autistic.,난 톰이 자폐증이란 걸 알고 있어.
Tom did that already.,톰은 그것을 이미 했어.
I'll take it.,내가 가져갈게.
You look smart.,너 똑똑해 보여.
I feel like a little kid.,꼬마가 된 기분이야.
Tom groaned.,톰이 앓는 소리를 했어.
You need to follow me.,당신은 나를 따라올 필요가 있다.
I'll go by subway.,지하철로 갈게.
This bike isn't safe to ride; the wheel wobbles too much.,이 바이크는 별로 안전하지 않아. 바퀴가 너무 흔들려.
Which one of you is Tom?,여러분 중에서 누가 톰이죠?
Fire!,쏴!
They both speak French.,둘 다 프랑스어를 할 줄 알아.
I should've told you about that sooner.,너한테 더 일찍 말했어야 했는데.
I must speak to you later about Tom.,나중에 톰에 대해 말해줄 것이 있다.
I'm not able to fix the computer.,난 컴퓨터를 고치는 것은 불가능해.
Did you like the flowers that I sent you?,내가 너한테 보낸 꽃 마음에 들었어?
Are you busy today?,오늘 바빠?
Tom has kids now.,톰한텐 이제 애들이 있어.
I enjoy taking pictures.,나 사진찍는 거 좋아해
I'm trying to do my best.,난 최선을 다하려고 노력하는 중이야.
Did you win the race?,경주에서 이겼습니까?
Tom sat down by the fire.,톰은 불 옆에 앉았다.
Tom's smiling.,톰은 웃고 있다.
I'm lonely without you.,너 없이는 외로워.
She disappeared.,그 사람이 사라졌어.
We've never lived in Australia.,우린 호주에서 살아 본 적이 없어.
He didn't reveal his secret.,그는 자신의 비밀을 밝히지 않았다.
Tom used to be weird.,톰은 한때 이상했었어.
How should I know?,저는 잘 모릅니다.
We've got a visitor.,손님이 있다.
"You're not retired yet, are you?","당신은 아직 은퇴하지 않은 거죠, 그렇죠?"
Release him.,그 사람을 놓아 줘.
Tom hates cats.,톰은 고양이를 싫어해.
You took the words right out of my mouth.,내 말이 바로 그 말이다.
Tom sat in the front row.,톰은 앞 줄에 앉았다.
What nonsense!,참 터무니없군!
I've gained weight again.,또 살이 쪄버렸어.
Tom said that he didn't think the heat bothered Mary.,톰은 더위가 메리를 괴롭힌다고 생각하지 않았다고 말했다.
Tom disappointed me.,톰이 나를 실망시켰다.
No one encouraged her.,아무도 그 사람을 격려하지 않았다.
Tom says he needs to talk to us about something important.,톰이 우리한테 뭔가 중요한걸 얘기하고 싶다는데.
This information is very important to us.,이 정보는 우리한테 있어서 정말 중요해요.
I can help you tomorrow.,난 널 내일 도와줄 수 있어.
"The number is 932-8647, but I don't know the area code.","번호는 932-8647인데, 지역 코드는 몰라."
Every Saturday we clean the whole house.,매주 토요일마다 우린 대청소를 해.
Tom is smiling.,톰은 웃고 있다.
He came out of the shower naked.,그는 알몸으로 샤워실에서 나왔다.
Do you like tofu?,두부 좋아해?
She is always at the bottom of the class.,걔는 항상 반에서 꼴찌야.
It happened prior to my arrival.,그 일은 내가 도착하기 전에 일어났어.
Ghosts exist.,유령은 존재해.
Tom admitted he's done that.,톰은 자신의 짓이라고 인정했다.
I really love what I do.,난 내가 하는 것이 정말 좋아.
I usually keep a diary when I travel.,나는 여행 중에 보통 일기를 쓴다.
Can the matter wait till tomorrow?,그 일은 내일까지 기다려도 돼?
Our class consists of 40 boys.,우리 반은 남자애 40명으로 구성되어 있어.
Tom won't be lonely if Mary is there.,메리가 있다면 톰은 외로워하지 않을 거야.
Kendo is a martial art.,검도는 무술이다.
"Quick, hide in here!","빨리, 여기에 숨어!"
Stop talking.,그만 말해.
It's snowing.,눈이 와요.
We're going to meet in front of the museum at 2:30.,우리는 2시 30분에 박물관 앞에서 만나기로 했다.
How many more days will you be in Boston?,며칠 더 보스턴에 있으려고?
No problem!,문제 없어!
Humans only live about 70 years.,인간은 70년정도 밖에 살지 않아.
Tom insisted.,톰이 주장했어.
My dog died.,내 개는 죽었어.
Nobody had any money.,아무도 돈이 없었어.
Get down!,엎드려!
Tom went to school by car.,톰은 자동차로 학교에 갔어.
There is a television in my room.,내 방에 TV가 있다.
I called Tom for help.,나는 톰에게 도움을 요청했다.
Please have a seat.,자리에 앉아 주시기 바랍니다.
You have to stop drinking.,당신은 음주를 그만둬야 한다.
There are things that can't be left to chance.,운에 맡길 수 없는 것들이 있다.
Japan and South Korea are neighbors.,일본과 남한은 이웃 국가다.
One year has twelve months.,1년은 열두 달이다.
I'm very depressed.,난 아주 우울해.
I felt excluded.,난 소외감을 느꼈어.
How many more days will you be in Boston?,며칠 더 보스턴에 있을 거야?
Examine them.,이것들 조사해봐.
Good luck.,행운을 빌어.
It's just not that easy.,그것이 그렇게 쉽지는 않아.
I'd like to mail this package to Australia.,이 소포를 오스트레일리아에 보내고 싶습니다.
What did you do after school yesterday?,너 어제 학교 끝나고 뭐했어?
Water is the only thing Tom will drink.,톰이 마실 수 있는 것은 오직 물 뿐이야.
It's too old.,그건 너무 낡았어.
I need somebody to talk to.,같이 얘기할 누군가가 있었으면 좋겠다.
"Meat, please.",고기로 할게요.
I wanted to make some telephone calls.,전화 통화를 좀 하고 싶었다.
It's far better than it used to be.,예전보다는 훨씬 나아졌다.
What's your cat's name?,네 고양이의 이름은 뭐야?
She designed beautiful costumes for the movie.,그녀는 영화에 쓸 아름다운 의상을 디자인했다.
My dogs killed one of Tom's cats.,내 강아지들은 톰이 키우는 고양이 중 한 마리를 죽였어.
Aren't you going to go there?,거기에 가 있지 않을 거야?
Why don't you eat now?,왜 지금 먹지 않나요?
Who is your favorite author?,네가 가장 좋아하는 작가는 누구야?
Stay a while and listen.,가만히 좀 들어.
I don't write letters anymore.,난 더 이상 편지는 쓰지 않아.
You decide.,네가 정해.
"Louder, please.",좀더 큰소리로 부탁해.
I've won first prize!,내가 1등을 했어!
Tom looked.,톰이 쳐다봤어.
Tom barely passed the exam.,톰은 시험 간신히 붙었어.
Tom has been crying every night.,톰은 매일 밤마다 울어댔다.
Give him the message when he comes back.,그가 돌아오면 메모를 전해주세요.
He is her friend.,그는 그녀의 친구다.
Tom said he needed some more time.,톰은 시간이 좀 더 필요하다고 말했다.
Tom was deeply shocked.,톰은 심한 충격을 받았어.
Tom wants to know if you have any time to help.,네가 도와줄 수 있는 시간이 있는지 톰이 궁금해하던데.
It won't help you.,도움이 안 될 것이다.
"Tom, I need your help.","톰, 도와줘."
The human mind is good at recognizing patterns.,인간의 마음은 패턴을 인식하는 것을 잘해.
We don't know whether Tom can come or not.,우리는 톰이 올수 있을지 없을지 모릅니다.
"Even though I slept for twelve hours, I'm still sleepy.",12시간 잤는데도 또 졸려.
I don't like your name.,저는 당신 이름이 싫어요.
She has a daughter who is tall.,그사람한테는 키가 큰 딸이 하나 있어.
Do you have the most recent version of this software?,이 소프트웨어의 가장 최신 버전을 갖고 있어?
She is beautiful.,그녀는 아름답다.
Everyone's going to be there.,모두들 거기 가 있을 거야.
"Tom isn't here, I assure you.","톰은 여기 없어, 내가 장담해."
When do you write?,언제 썼어?
The coat is on the chair.,코트는 의자에 있어.
My cell phone doesn't work.,내 핸드폰은 동작하지 않아.
I'd like to learn how to ski.,나는 스키타는 법을 배우고 싶어.
I wanted to do something nice for you.,뭔가 너한테 좋은 것을 해주고 싶었어.
Have you gone nuts?,너 미쳤구나?
This annoys me.,이것은 나를 짜증나게 한다.
Selling cars is my job.,제 직업은 카셀러입니다.
I'm not going to give up.,나는 포기하지 않을 것이다.
I will be sixteen years old next year.,내년이면 나는 열여섯 살이 된다.
I live very close to the subway station.,난 지하철 역에서 아주 가까운 곳에 살아.
Don't be so silly.,실없게 굴지마.
I assure you that isn't necessary.,저건 필요 없다니까.
Is it too late?,너무 늦었나요?
I'm sorry that you had to hear that.,그걸 들어야 했다니 유감이야.
Keep looking.,계속 보고 있어봐.
Look back!,뒤에 봐봐!
Everything's normal.,모든 것이 정상이야.
Yesterday was Sunday.,어제는 일요일이었다.
You scared Tom.,넌 톰을 무섭게 했어.
Tom flinched.,톰이 움찔했어.
Tom wants to learn how to shoot.,톰은 총 쏘는 법을 배우고 싶어 해.
Tom is a timid child.,톰은 소심한 어린이야.
Come here.,여기로 와.
I was in New York for a few days.,나는 며칠 동안 뉴욕에 있었다.
Are you saying that I'm a liar?,내가 거짓말쟁이라는 거야?
Tom doesn't drink alcoholic drinks at all.,톰은 알코올이라면 전혀 입에 대지 않아.
I took the subway yesterday.,어제 지하철을 탔어.
They laughed.,그 사람들 웃었어.
Those are mine.,그것들은 내 것이다.
Who really called?,진짜로 누가 전화한 거야?
Why should I learn French?,왜 프랑스어를 배워야 하는 거지?
We were in Australia last week.,우린 지난주에 호주에 있었어.
I am at home.,나는 집에 있다.
Is there something that you wish to tell me?,뭔가 할 말이 있니?
This is a complete distortion of the facts.,이건 사실에 대한 완전한 왜곡이야.
Could you tell me your present address?,현주소를 말씀해 주시겠습니까?
Tom is wearing a blue coat.,톰은 파란 코트를 입고 있어.
I wonder what Tom is going to do this afternoon.,나는 톰이 오후에 뭘 할 건지 궁금하다.
What have you bought your girlfriend for Christmas?,크리스마스에 여친에게 뭘 사줬니?
Be careful. There's a hole in the floor.,조심해. 바닥에 구멍이 있어.
I want to become a doctor.,나는 의사가 되고 싶다.
I think I understand.,이해했습니다.
It's really hard to stop.,그만 두는 건 너무 어려워.
"It was Tom's idea, not mine. Don't blame me.",그건 내 생각이 아니라 톰의 생각이었어. 내 탓 하지 마.
Tom is silly.,톰은 실없어.
I saw my mother hide the cake.,나는 어머니가 케이크를 숨기는 것을 보았다.
Everybody wants permanent peace.,모두가 영원한 평화를 원한다.
Don't worry. Someone will come and rescue us eventually.,걱정하지 마. 결국 누군가 와서 우리를 구출할 거야.
Tom is eager.,톰은 열성적이야.
Tom filled the wheelbarrow with sand.,톰은 외바퀴 손수레를 모래로 채웠다.
My younger sister plays piano every day.,우리 여동생은 날마다 피아노를 친다.
That sounds reasonable.,합리적으로 들리네.
Education is the key to success.,교육이야말로 성공으로 가는 길이야.
It's the highest building in this city.,이것은 이 도시에서 가장 높은 빌딩이다.
I'll give this to Tom.,내가 이 것을 톰에게 줄거야.
"If you don't help Tom, he'll have trouble doing it.",네가 톰을 도와주지 않는다면 톰은 곤란에 처할 거야.
Tom is a methamphetamine addict.,톰은 메스암페타민 중독자야.
That's all I want.,그게 내가 바라는 전부야.
Do you think eating breakfast every day is important?,매일 아침을 먹는 것이 중요하다고 생각하나요?
Did Tom see you?,톰이 널 봤어?
How romantic!,정말 로맨틱해!
Are you busy today?,오늘 바쁘신가요?
I can both sing and dance.,나는 노래도 부를 줄 알고 춤도 출 줄 알아.
I don't use social media.,나는 소셜 미디어는 안 써.
No news is good news.,무소식이 희소식이다.
Would you like some more?,더 먹을래?
Are we off the record?,저희 이거 비밀로 하실 거죠?
She majors in medicine.,그녀는 의학을 전공하고 있습니다.
It's not my decision.,내가 결정한 게 아니다.
He denied that fact.,그는 그 사실을 부인했다.
I have two sons.,나에게는 아들이 둘 있다.
Eating out is something that I don't do very often.,외식은 내가 그렇게 자주 하는 것이 아니다.
I'm a little confused.,나는 조금 혼란스럽다.
I've had a thing for rabbits ever since.,나는 그때부터 토끼에게 끌리기 시작했다.
A wise leader knows when to listen.,지혜로운 리더는 언제 들어야 할지를 안다.
Tom didn't know who was going to be there.,톰은 누가 거기에 있을 건지 몰랐어.
Tom said that Mary knew that John might not be allowed to do that.,톰은 마리가 존이 그걸 하면 안 될 거라는 걸 알았다고 말했다.
I'm behind you.,난 네 뒤에 있어.
She was busy.,그는 바빴다.
Tom's dog is very big.,톰 강아지는 정말 커.
Is there bus service to the airport?,공항까지 가는 버스가 있나요?
Tom looked like he was confused.,톰은 혼란스러워하는 것처럼 보였어.
You don't need to prove anything to me.,나한테 아무것도 증명할 필요 없어.
Tom is quite a guy.,톰은 별난 녀석이야.
Nothing is certain but death and taxes.,죽음과 세금만큼 확실한 것은 없어.
The prisoners were set free.,죄수들은 풀려났다.
Are you interested in science?,과학에 관심 있니?
Accept your fate.,운명을 받아들여라.
We had fun with Tom.,우리는 톰과 즐거운 시간을 가졌다.
"Being too nervous to reply, he stared at the floor.","대답하기에 너무 긴장되어서, 그는 바닥을 응시했다."
I can't walk fast.,난 빠른 걸음을 할 수 없어.
That's money that's been wasted.,그것은 낭비된 돈이다.
Tom is just getting used to this.,톰은 이것에 익숙하다.
Why didn't you tell me you weren't going to be there?,왜 네가 거기에 안 갈 거라고 말 나한테 안 했어?
I am telling a story.,나는 이야기를 들려주고 있다.
I know that Tom is a very quiet person.,나는 톰이 아주 조용한 사람이라는 걸 알고 있어.
"Sorry, I'm late.",늦어서 미안합니다.
I have a sister.,나에게는 누나가 있다.
I'm a simple girl.,저는 단순한 소녀에요.
She lives in a large house.,그녀는 큰 집에서 산다.
Tom exhaled.,톰이 숨을 내쉬었어.
I didn't want to get hurt.,나는 다치고 싶지 않았다.
Let's visit some temples tomorrow.,내일 사원에 한번 가보자.
His speech moved us.,그의 연설은 우리를 움직였다.
"Things are the same, but people have changed.",상황은 같지만 사람들은 바뀌었다.
I have to take my medicine every six hours.,나는 약을 여섯 시간마다 먹어야 해.
Tom looks pretty sleepy.,톰은 상당히 졸려 보인다.
Her uncle is a famous doctor.,그녀의 삼촌은 유명한 의사입니다.
I think you're the greatest.,난 네가 최고라고 생각한다.
How far is it to the train station?,기차역까지 얼마나 멀어?
That's all I want.,내가 바라는 건 그게 다야.
Stop worrying.,그만 걱정해.
I heard that Tom attempted suicide.,톰이 자살을 시도했다고 들었어.
I didn't know where I should go.,어디로 가야할지 몰랐다.
Tell everybody.,모두한테 말해.
Would you stop doing that?,그것 좀 멈춰 줄래?
I regret leaving.,나는 떠난 것을 후회한다.
It's very humid.,상당히 습하다.
It's a dictionary.,이것은 사전이다.
How arrogant!,이렇게나 건방지다니!
Everyone laughed.,모두가 웃었어.
I may be too old.,난 너무 늙었을지도 몰라.
"I don't have much money, but I can get along somehow.","나는 돈이 별로 없지만, 그럭저럭 지낼 수 있다"
Tom Jackson easily won the election.,톰 잭슨은 손쉽게 선거에서 이겼다.
I like to travel alone.,나는 혼자 여행하는 것을 좋아해.
I didn't think Tom knew how to drive.,난 톰이 운전하는 법을 안다는 걸 몰랐어.
What in the world is this?,이게 대체 뭐예요?
Goodbye!,안녕!
I didn't think you were coming.,네가 오는 줄 몰랐어.
That's just about it.,거의 다 됐어요.
Try to see the problem from her point of view.,그 사람의 관점으로 문제를 보려고 노력하자.
We should consider the problem from a child's point of view.,우린 어린이의 관점으로 문제를 고려해야 해.
Tom swims well for his age.,톰은 나이에 비해 수영을 잘해.
I don't have a cell phone.,나한텐 핸드폰이 없어.
I should've told you everything earlier.,너한테 모든 걸 좀 더 빨리 얘기했어야 했는데.
Where will you go tomorrow?,내일 어디로 갈거야?
Are you studying?,공부하고 계십니까?
Tom doesn't know why I'm here yet.,톰은 제가 왜 여기 있는지 아직 모릅니다.
Have you talked to the doctors yet?,아직 의사랑 말 안했어?
"I don't know if it's a bug or what, but this software doesn't work right.","이게 버그인지 아닌지 모르겠는데, 이 소프트웨어는 제대로 동작하지 않아."
The real issue is how to prevent the disease.,진짜 문제는 어떻게 질병을 막는지야.
I no longer study French.,나는 더 이상 프랑스어를 공부하지 않는다.
Tom claimed that he owned that expensive-looking red car we saw yesterday.,톰은 우리가 어제 봤던 비싸보이는 빨간 자동차가 자기 것이라고 주장했어.
Come to my house whenever you like.,언제든지 우리 집에 와.
Everyone prayed.,모두 기도했어.
Attention please!,여기 주목!
I'm a man.,나는 남자다.
